{
  "$schema": "https://json-schema.org/draft/2020-12/schema",
  "$id": "urn:blockpedia:schema:provider:annotation-wire-item.v1",
  "type": "object",
  "additionalProperties": false,
  "required": [
    "variant_id",
    "synonyms_zh",
    "synonyms_en",
    "summary_zh",
    "summary_en",
    "color_terms",
    "shape_terms",
    "material_impressions",
    "building_roles",
    "style_tags",
    "avoid_for",
    "confidence",
    "reason"
  ],
  "properties": {
    "variant_id": {
      "type": "string",
      "pattern": "^minecraft:[a-z0-9_./-]+$"
    },
    "synonyms_zh": {
      "type": "array",
      "maxItems": 32,
      "uniqueItems": true,
      "items": {
        "type": "string",
        "minLength": 1,
        "maxLength": 120
      }
    },
    "synonyms_en": {
      "type": "array",
      "maxItems": 32,
      "uniqueItems": true,
      "items": {
        "type": "string",
        "minLength": 1,
        "maxLength": 120
      }
    },
    "summary_zh": {
      "type": "string",
      "minLength": 2,
      "maxLength": 500
    },
    "summary_en": {
      "type": "string",
      "minLength": 2,
      "maxLength": 500
    },
    "color_terms": {
      "type": "array",
      "maxItems": 16,
      "uniqueItems": true,
      "items": {
        "type": "string",
        "minLength": 1,
        "maxLength": 64
      }
    },
    "shape_terms": {
      "type": "array",
      "maxItems": 16,
      "uniqueItems": true,
      "items": {
        "type": "string",
        "minLength": 1,
        "maxLength": 64
      }
    },
    "material_impressions": {
      "type": "array",
      "maxItems": 16,
      "uniqueItems": true,
      "items": {
        "type": "string",
        "minLength": 1,
        "maxLength": 64
      }
    },
    "building_roles": {
      "type": "array",
      "maxItems": 16,
      "uniqueItems": true,
      "items": {
        "type": "string",
        "minLength": 1,
        "maxLength": 64
      }
    },
    "style_tags": {
      "type": "array",
      "maxItems": 16,
      "uniqueItems": true,
      "items": {
        "type": "string",
        "minLength": 1,
        "maxLength": 64
      }
    },
    "avoid_for": {
      "type": "array",
      "maxItems": 16,
      "uniqueItems": true,
      "items": {
        "type": "string",
        "minLength": 1,
        "maxLength": 64
      }
    },
    "confidence": {
      "type": "number",
      "minimum": 0,
      "maximum": 1
    },
    "reason": {
      "type": "string",
      "minLength": 2,
      "maxLength": 500
    }
  }
}
